Date,Type,Source,Message,Inventory_Impact,Revenue_Impact,Details_URL
2023-03-15,Black Swan,External,Massive Fire at Northwest Plant,-2000000,-3000000,https://www.example.com/fire-disruption
2023-04-20,White Swan,External,Unexpected Surge in E-commerce Demand,500000,800000,https://www.example.com/ecommerce-boom
2023-05-12,Black Swan,External,Supply Chain Delays due to Trade War,-1500000,-2500000,https://www.example.com/trade-war-impact
2023-06-10,White Swan,External,Successful Product Launch Boosted Sales,400000,600000,https://www.example.com/product-launch
2023-07-25,Black Swan,External,Hurricane Disruptions in Southeast Region,-1000000,-2000000,https://www.example.com/hurricane-damage
